ID,NAME,CATEGORY,MAKE_YEAR,MODEL_NUMBER,PRICE,SELLER_ID,QUANTITY,SPECS,REMARKS
1000000001,Computer,Electronics,2015,ABCD1214XYZ,60000.00,1000000002,6,Computer,"Nothing to say"
1000000002,"Macbook 16",Electronics,2019,ABCD121212B,240000.98,1000000002,9,"I7 16 Inch A11 chip","Fetured and brand new product"
1000000003,"IPHONE 12",MOBILES,2020,ABGCGDKS24242,65999.99,1000000005,39,"M11 Chip","Latest configuration best offer"
1000000004,"Redmi Note 2",Mobiles,2021,MI473264,23999.00,1000000005,120,"8 GB RAM 128 GB ROM","Latest Phone from MI at best offer"
1000000005,"Redmi note 3",Mobiles,2021,MI32435q3,34999.99,1000000005,10,"5G, 8GB RAM 256GB ROM","New Product withg best deal"
